"episode_number","title","date"
407,"Rick Ross on Adin Ross Getting Scammed, Defends Taylor Swift & Kanye West, Addresses Nicki Minaj",2024-02-06
406,"Our Ex Co-Host Is BACK! Life After IMPAULSIVE, Meeting Jesus, Logan Addresses WWE Injury",2024-01-31
405,"The John Cena Interview",2024-01-24
404,"Chris Hansen On Catching Predators, Jeffrey Epstein’s Island, Students Hooking Up w/ Teachers",2024-01-16
403,"Rubi Rose On Hooking Up w/ White Men, Responds to Tate Brothers, Exposes Rich Crypto Stalker",2024-01-09
402,"IMPAULSIVE’S TOP 23 MOMENTS OF 2023",2023-12-26
401,"Jake & Logan Paul Fight Over KSI, Offer $20M To Andrew Tate And His Brother For MMA Superfight",2023-12-19
400,"Famous 13 Year Old Hijacks Logan Paul’s Interview",2023-12-12
399,"Randy Orton Returns To WWE",2023-12-05
398,"Casey Neistat’s Falling Out with David Dobrik, PRIME vs. Feastables, #1 Advice for YouTubers",2023-11-21
397,"Logan Paul Saves Rey Mysterio’s Life, MrBeast Makes Huge Mistake, PRIME Sells $1.2 Billion",2023-11-14
396,"Sofia Franklyn On Hooking Up with Nelk, Leaks Logan Paul’s Net Worth & Her Body Count",2023-11-07
395,"KSI on Beating Tommy Fury, End of the Sidemen, Fighting Jake Paul",2023-10-31
394,"Mark Cuban on Giving MrBeast $1,000,000, Elon Musk Ruining Twitter, Rejecting Jake Paul",2023-10-25
393,"Logan Paul on Beating Dillon Danis, KSI Losing vs Tommy Fury, Apologizing to Nina Agdal",2023-10-17
392,"Logan & Jake Paul Face Off, Address Steroid Accusations, Expose Dillon Danis",2023-09-14
391,"Akon & Logan Paul Debate Christianity, Share Michael Jackson’s Secret, Eminem Co-Hosting IMPAULSIVE",2023-09-05
390,"Erling Haaland Predicts KSI Loss, Winning Premier League, Dillon Danis vs Logan Paul",2023-08-29
389,"RackaRacka on Making Logan Paul & KSI Billionaires, Earning $36M from Horror Film ‘Talk To Me’",2023-08-15
388,"Jake Paul & Logan Paul on Double Victory (Boxing/WWE), KSI vs Tommy Fury, Fighting Dillon Danis",2023-08-08
387,"Nina Agdal On Marrying Logan Paul, Making Him Wait to Hook Up, Becoming A Supermodel",2023-08-01
386,"Logan Paul Gets Engaged, Andrew Tate Escapes Prison, Full Send VS Schulz, FDA Investigating PRIME?!",2023-07-25
385,"Seth Rollins On Beating Logan At WrestleMania, Getting Attacked by Fan, Hatred for Dominik Mysterio",2023-07-18
384,"Bear Grylls On Firing At KSI, Drinking His Own Urine, Man vs. Wild Best Moments",2023-07-11
383,"Logan Paul Announces UFC Debut On Elon VS Zuck Undercard, KSI v. Tommy Fury, MrBeast Is Thirsty",2023-07-04
382,"Prince Royce On Relationship w/ Jennifer Lopez, Logan’s Cringe Singing, Being Robbed in LA",2023-06-27
381,"Alex Volkanovski On Sparring Logan Paul, Message To Dana White, Wild Aussie Girls",2023-06-20
380,"Nicky Jam On Logan Paul VS Bad Bunny, Sliding in Lana Rhoades DM, Rise Of Peso Pluma",2023-06-13
379,"Israel Adesanya Chokes Out Logan Paul, Hated By Jon Jones, Signs $$ Deal w/ PRIME",2023-06-06
378,"Jake Paul Snaps On Theo Von, Conor McGregor’s Wife & KSI’s Illegal Punch",2023-05-30
377,"David Blaine’s Magic SHOCKS Logan Paul, Exposes MrBeast, Frog Swallow Trick Revealed",2023-05-23
376,"Ice Cube On Death Threats From Suge Knight, Fallout w/ Kevin Hart, LeBron VS Jordan",2023-05-16
375,"Jeff Wittek Joins IMPAULSIVE, Logan Paul Reveals Shocking UFO Video, Suing Nate Diaz",2023-05-09
374,"The Kevin Hart Interview",2023-05-02
373,"Edge Addresses Logan Paul Ruining WWE, Roman Reigns Losing, Turning Down Undertaker",2023-04-25
372,"Bert Kreischer Exposes Joe Rogan & Theo Von, Accidentally Joins The Russian Mafia",2023-04-18
371,"Rey Mysterio Removes Mask, Regrets Beating His Son, Logan Paul Honors Eddie Guerrero",2023-04-11
370,"Logan Paul Finally Beats KSI, Hasbulla Cancelled, Kim Kardashian Caught w/ PRIME",2023-04-04
369,"Ryan Garcia Says KSI Is Trash, Will KO Gervonta Davis, Mayweather Jumps Jake",2023-03-28
368,"Logan Paul Ditched Lele Pons & Guaynaa’s Wedding, Turning Down $20M From WWE",2023-03-21
367,"Dave Portnoy Sells Barstool For $610M, Calls KSI Irrelevant, Admits He Lied To Rogan",2023-03-14
366,"Jake Paul Devastated After Tommy Fury Loss, Embarrassed By KSI & Cristiano Ronaldo",2023-03-07
365,"LazarBeam & Logan Paul Call Out MrBeast For Stealing, Adin Ross Banned From Twitch",2023-02-28
364,"Nick Kyrgios ‘Tennis Bad Boy’ On Beating Nadal Hungover, JiDion’s Haircut Prank",2023-02-21
363,"The KSI Interview: Jake Paul v. Tommy Fury, Gets Back With Ex, Calls Out Speed",2023-02-14
362,"Bruce Buffer On Logan Paul Fighting UFC, Dark Times w/ Dana White, Battling McGregor",2023-02-07
361,"E363 Cody Rhodes Wins Royal Rumble, Logan Paul Joins UFC, George Janko Lied To You",2023-01-31
360,"E362 Kehlani Is Scared Of Logan & Mike, Explores Her Sexuality, Dating Men VS. Women",2023-01-24
359,"E361 Yung Gravy On Hooking Up w/ Addison Rae’s Mom, Lisa Ann & Elon Musk Trashing Logan",2023-01-17
358,"E360 Andrew Santino On Fall Of Logan Paul & Kanye, Ex-Girlfriends, Bobby Lee VS George",2023-01-10
357,"E359 Logan Paul Addresses Crypto Scam Allegations, Apologizes To George For Mocking Faith",2023-01-04
356,"E358 IMPAULSIVE’S TOP 22 MOMENTS OF 2022",2022-12-27
355,"E357 Wiz Khalifa Reveals Mia Khalifa Relationship, Gets Logan Paul Baked, Losing Mac",2022-12-20
354,"E356 Logan Paul Praises Andrew Tate, Slams Liver King For Lying, Warns Paddy The Baddy",2022-12-13
353,"E355 FaZe Banks Confesses Love For Alissa Violet, Hatred For Jake Paul, Adin Ross",2022-12-06
352,"E354 David Guetta’s Supermodel Hit List, Ibiza Blackouts, Why French Hate Americans",2022-11-29
351,"E353 Rob Dyrdek On Jake Paul’s Failure, The Death of Big, Living Forever",2022-11-22
350,"E352 Logan Paul Confirms Tate VS Jake, Rejects $1B From Elon Musk, Calls Out John Cena",2022-11-15
349,"E351 Bobby Lee Confesses Love For KSI & Lana Rhoades, Urges Kanye West To Seek Help",2022-11-08
348,"E350 Jake Paul Beats Silva, Hates Logan & KSI’s Friendship, Reveals Next Opponent",2022-11-01
347,"E349 Shawn Michaels On Logan Paul VS Roman Reigns, Triple H Saving His Life, WWE Future",2022-10-25
346,"E348 Gabriel Iglesias Confronts Travis Scott, Obesity, Last Words To Robin Williams",2022-10-18
345,"E347 Sebastian Maniscalco’s Beef With Joe Rogan & Jake Paul’s Team 10 House",2022-10-11
344,"E346 Shaq Talks Kobe Regrets, Why LeBron Isn’t GOAT, Says Logan Is Next Jeffrey Dahmer",2022-10-04
343,"E345 Logan Paul Fires Co-Hosts, Exposes New Girlfriend, Bashes Deji VS. Mayweather",2022-09-27
342,"E344 Michael Blackson On Kevin Hart Beef, Nick Cannon’s Addiction, Pulling Side Chicks",2022-09-20
341,"E343 Roman Reigns Embarrasses Logan Paul, Reveals John Cena Beef & Fighting The Rock",2022-09-13
340,"E342 Roman Atwood On Quitting YouTube, Surviving Stalker FBI Raid, Having 3 Wives",2022-09-06
339,"E341 Logan Paul’s Message To Andrew Tate and KSI",2022-08-30
338,"E340 Charlamagne Reveals Lana Rhoades’ Baby Daddy, Calls Out 6ix9ine & Post Malone",2022-08-23
337,"E339 Markiplier Tells Logan Paul How To Make $38M From YouTube, Death Of Unus Annus",2022-08-16
336,"E338 Jake Paul Rips KSI’s Boxing Career, Exposes DM From Andrew Tate",2022-08-09
335,"E337 Triple H On Logan Paul Joining WWE, Rivalry With The Rock & Stone Cold",2022-08-02
334,"E336 Dane Cook’s Brother Stole $15M From Him, Andrew Schulz & Dave Chappelle Censorship",2022-07-26
333,"E335 Logic Raps LIVE, Comes Out Of Retirement, Exposes 6ix9ine As A Fraud",2022-07-19
332,"E334 Our New Co-Host Is Pregnant, Logan Paul Signs With WWE, Mike Offends A Fan",2022-07-12
331,"E333 The Sidemen Reveal KSI’s Problem, Jake Paul Diss Track, UK vs. American Women",2022-07-05
330,"E332 Kevin O’Leary Trashes Logan Paul’s Company, Reveals Biggest Shark Tank Regrets",2022-06-28
329,"E331 JiDion On KSI Changing His Life, Pokimane Twitch Ban, Hooking Up With Lizzo",2022-06-21
328,"E330 Jeffree Star On Hooking Up With Kanye West, Fall Of Shane Dawson & James Charles",2022-06-14
327,"E329 Beeple Sold An NFT For $69,000,000 And Embarrassed Logan Paul",2022-06-07
326,"E328 Liam Payne Wants To Fight Justin Bieber & KSI, Reveals Why One Direction Broke Up",2022-05-31
325,"E327 Snoop Dogg’s Last Moments With 2Pac & Kobe, Betting On Jake Paul",2022-05-24
324,"E326 Logan Paul Fires Co-Host, Loses Millions On NFTs (Shocking)",2022-05-17
323,"E325 The Liver King Calls Out Joe Rogan, Eats Raw Liver LIVE, Rejects Steroid Rumors",2022-05-10
322,"E324 Gary Vee On Discovering Logan Paul, Kobe Bryant Regrets, $100M+ NFT Collection",2022-05-03
321,"E323 Logan Paul Pukes On Model At Coachella, Chokes Out Greg Paul (w/ Brendan Schaub)",2022-04-26
320,"E322 Jorge Masvidal On Hatred For Colby Covington & Jake Paul",2022-04-19
319,"E321 IMPAULSIVE LIVE: Logan Paul Breaks Hand, Ends Boxing Career",2022-04-12
318,"E320 Logan Paul’s WrestleMania Debut, Joined By Superstars Sasha Banks & Becky Lynch",2022-04-05
317,"E319 The Chainsmokers On Unreleased Juice WRLD, Camila Cabello, Finding Halsey",2022-03-29
316,"E318 Steve Aoki On Partying With Kanye West & Making More Money With NFTs Than Music",2022-03-22
315,"E317 Dana White Responds To Donald Trump, Nelk Boys & Jake Paul",2022-03-15
314,"E316 Tony Robbins Reveals How To Live Forever",2022-03-08
313,"E315 Oliver Tree To Logan Paul: “I Don’t F*** With You”",2022-03-01
312,"E314 The Arnold Schwarzenegger Interview",2022-02-22
311,"E313 Logan Paul Is In Love",2022-02-15
310,"E312 Mike Posner Explains Why He Took A Pill In Ibiza",2022-02-01
309,"E311 Antonio Brown Quits Football",2022-01-25
308,"E310 Lana Rhoades’ Baby, $3.5M Pokémon Scam, Exposing Girls That Slid In Logan’s DMs",2022-01-18
307,"E309 The Return Of KSI",2022-01-11
306,"E308 She Cheated On Me With A Billionaire",2022-01-04
305,"E307 Never Sleep With Her On The First Date",2021-12-28
304,"E306 Jake Paul Is The Next Muhammad Ali",2021-12-21
303,"E305 The Island Boys Interview",2021-12-14
302,"E304 The Jake Paul Interview: Tommy Fury Backs Out",2021-12-07
301,"E303 Alec Monopoly Vandalized Our Studio",2021-11-30
300,"E302 Hooking Up With My Best Friend’s Ex",2021-11-23
299,"E301 Why Bitcoin Will Die (w/ Peter Schiff)",2021-11-16
298,"E300 Our 300th And Worst Episode Ever",2021-11-09
297,"E299 Theo Von Hooked Up With Our Fan",2021-11-02
296,"E298 One Of Us Is Raising Our Ex’s Baby",2021-10-26
295,"E297 Howie Mandel Has Lost His Mind",2021-10-19
294,"E296 Dan Bilzerian’s Famous Celebrity Hookup",2021-10-12
293,"E295 Adam Ray Roasts Logan Paul’s Love Life",2021-10-07
292,"E294 My Friends Confront My Addiction",2021-10-01
291,"E293 Game Of Thrones Biggest Star: Thor ’The Mountain’ Bjornsson",2021-09-23
290,"E292 TommyInnit Explains Minecraft To Logan Paul",2021-09-14
289,"E291 The Time Mr. Beast Almost Died",2021-09-07
288,"E290 Sean O’Malley Is The Future Of The UFC",2021-08-31
287,"E289 The Jake Paul Interview: Knocking Out Tyron Woodley",2021-08-26
286,"E288 The WWE Interview: Nikki Bella, Bobby Lashley & Riddle",2021-08-24
285,"E287 Our First Episode In Puerto Rico",2021-08-17
284,"E286 Trippie Redd Smokes Us Out",2021-08-10
283,"E285 DJ Scheme Shares Final Moments With Juice WRLD & XXXTENTACION",2021-08-03
282,"E284 Our Last Episode In LA...",2021-07-27
281,"E283 The KSI Interview",2021-07-20
280,"E282 Adin Ross Is Dating His Sister",2021-07-15
279,"E281 The End Of Conor McGregor & Addison Rae’s Career",2021-07-13
278,"E280 Corinna Kopf Hooked Up With Your Favorite Influencer",2021-07-06
277,"E279 Logan Paul’s Final Goodbye To Mike & George",2021-06-29
276,"E278 What Was It Like Fighting Floyd Mayweather?",2021-06-10
275,"E277 Logan Paul’s Final Message To Floyd Mayweather",2021-06-03
274,"E276 Logan Paul Confirms Floyd Mayweather Fight & Move To Puerto Rico",2021-04-29
273,"E275 Jake Paul Speaks on Ben Askren KO, Calls Out Next Opponent *Exclusive*",2021-04-20
272,"E274 The Jake Paul Interview: Knocking Out Ben Askren",2021-04-15
271,"E273 Jeff Wittek Comes Clean",2021-04-13
270,"E272 The Ben Askren Interview: Knocking Out Jake Paul",2021-04-08
269,"E271 Olivia O’Brien Hates Us, But Loves You",2021-04-06
268,"E270 Logan Paul Speaks On David Dobrik, Masked Singer Reveal & Jake Paul VS. Ben Askren",2021-04-01
267,"E269 Chase Hero: From Broke To Millionaire In 14 Days",2021-03-30
266,"E268 24kGoldn’s #1 Hit Is A Mood",2021-03-25
265,"E267 We Want Sommer Ray On OnlyFans",2021-03-23
264,"E266 Jason Ellis *Viewer Discretion Advised*",2021-03-18
263,"E265 Too Hungover To Podcast",2021-03-16
262,"E264 Chris Distefano: Try Not To Laugh",2021-03-11
261,"E263 Exposing The Richest YouTubers",2021-03-09
260,"E262 James Fox Reveals Most Compelling Alien Evidence Ever",2021-03-04
259,"E261 Logan Paul Spent $170,000 On An NFT",2021-03-02
258,"E260 Chet Hanks Blasts Tom Hanks Conspiracy Rumors",2021-02-25
257,"E259 Mike & Lana Broke Up (Officially)",2021-02-23
256,"E258 Chantel Jeffries Lost Logan Paul $2,500,000",2021-02-18
255,"E257 Logan Paul Is Leaving California...",2021-02-16
254,"E256 OnlyFans Millionaire & Prank God: Jackson O’Doherty",2021-02-11
253,"E255 Tim Dillon Roasts Joe Rogan, Dr. Fauci & Dixie D’Amelio",2021-02-09
252,"E254 Rob Gronkowski Exposes Tom Brady",2021-02-04
251,"E253 Why Floyd Mayweather VS. Logan Paul Was Postponed...",2021-02-02
250,"E252 WallStreetBets Founder Exposes Robinhood Corruption & GameStop Boom",2021-01-28
249,"E251 Logan Paul Loses His Phone Sex Virginity",2021-01-26
248,"E250 What Is Bitcoin & How Does It Work? (w/ Andrei Jikh)",2021-01-07
247,"E249 Logan Paul Responds to Jake Paul: ’My Brother Is A Fake Fighter’",2021-01-05
246,"E248 IMPAULSIVE’S TOP 20 MOMENTS OF 2020",2021-01-01
245,"E247 The Mike Tyson Interview",2020-12-29
244,"E246 Andrew Schulz Is Uncancellable",2020-12-24
243,"E245 Teague Egan Is The Next Elon Musk",2020-12-22
242,"E244 Sam Dameshek: Hollywood’s Celebrity Photographer",2020-12-17
241,"E243 Jake Paul Slams Conor McGregor, His Wife & Dana White",2020-12-15
240,"E242 Belle Delphine Stars In Her First Adult Film",2020-12-10
239,"E241 Logan Paul’s Strategy To Beat Floyd Mayweather",2020-12-08
238,"E240 Nick Kroll: The Voice Behind Hollywood’s Hormones",2020-12-03
237,"E239 Logan Paul Criticizes Jake Paul’s Vicious Nate Robinson KO",2020-12-01
236,"E238 Jake Paul Vs. The World",2020-11-26
235,"E237 Your Direct Messages Are Embarrassing",2020-11-24
234,"E236 Iann Dior",2020-11-19
233,"E235 I Got Invited To A Hollywood Sex Party",2020-11-17
232,"E234 John Shahidi: Social Media Mastermind",2020-11-12
231,"E233 One Year Since Losing To KSI",2020-11-10
230,"E232 Julia Rose Uncensored",2020-11-05
229,"E231 Dear Mr. President",2020-11-03
228,"E230 Logan Paul’s Assistant: ’I’m Not Your Friend’",2020-10-29
227,"E229 David Dobrik’s Perfume Makes No Scents",2020-10-27
226,"E228 We Got Roasted By Jo Koy",2020-10-22
225,"E227 How Do YouTubers Get Hot Girls?",2020-10-20
224,"E226 Sadhguru Explains Life, Death, And Heaven",2020-10-15
223,"E225 Goodbye George, Spencer Is Back! - IMPAULSIVE EP. 225",2020-10-13
222,"E224 Dave Portnoy Calls Out Logan Paul For Call Her Daddy Breakup - IMPAULSIVE EP. 224",2020-10-08
221,"E223 An Honest Message To Our High School Teachers - IMPAULSIVE EP. 223",2020-10-06
220,"E222 Jack ’CouRage’ Dunlop Shoots His Shot - IMPAULSIVE EP. 222",2020-10-01
219,"E221 Logan Paul Addresses Next Boxing Opponent - IMPAULSIVE EP. 221",2020-09-29
218,"E220 Alex Warren Is Not David Dobrik - IMPAULSIVE EP. 220",2020-09-24
217,"E219 Meet Our Controversial New Host - IMPAULSIVE EP. 219",2020-09-22
216,"E218 YouTube’s Legend: Casey Neistat - IMPAULSIVE EP. 218",2020-09-17
215,"E217 Captain America And Belle Delphine Have A Social Dilemma - IMPAULSIVE EP. 217",2020-09-15
214,"E216 The Return Of Charlie Rocket - IMPAULSIVE EP. 216",2020-09-11
213,"E215 The 6ix9ine Interview - IMPAULSIVE EP. 215",2020-09-09
212,"E214 Hannah Stocking Tattoos Us & Smokes For Science - IMPAULSIVE EP. 214",2020-09-03
211,"E212 Lele Pons La Superestrella Latina - IMPAULSIVE EP. 212",2020-08-27
210,"E211 Boys Night Gone Horribly Wrong - IMPAULSIVE EP. 211",2020-08-25
209,"E210 Dolan Twins Squash The Beef With Logan Paul - IMPAULSIVE EP. 210",2020-08-20
208,"E209 Girlfriends: Stay Away From Our Butts - IMPAULSIVE EP. 209",2020-08-18
207,"E208 Nadeshot Talks Warzone, Dr. Disrespect & Future Of Fortnite - IMPAULSIVE EP. 208",2020-08-13
206,"E207 Cardi B And Meg Thee Stallion Broke The Internet - IMPAULSIVE EP. 207",2020-08-11
205,"E206 George Janko Found Logan Paul Through Jesus - IMPAULSIVE EP. 206",2020-08-06
204,"E205 Ellen Degeneres Probably Hates You - IMPAULSIVE EP. 205",2020-08-04
203,"E204 Why Is Bryce Hall Afraid To Date Addison Rae? - IMPAULSIVE EP. 204",2020-07-30
202,"E203 Jake Paul Speaks On Outperforming KSI & Boxing Nate Robinson - IMPAULSIVE EP. 203",2020-07-28
201,"E202 Netflix Star Harry Jowsey Opens Up About Relationship with Francesca Farago - IMPAULSIVE EP. 202",2020-07-23
200,"E201 ADDISON RAE HATES US - IMPAULSIVE EP. 201",2020-07-21
199,"E200 HI SISTERS... IT’S JAMES CHARLES - IMPAULSIVE EP. 200",2020-07-16
198,"E199 The Next President: Yeezy VS. Trump - IMPAULSIVE EP. 199",2020-07-14
197,"E198 Carl Lentz Explains Jesus - IMPAULSIVE EP. 198",2020-07-02
196,"E197 SHANE DAWSON CANCELLED, JENNA MARBLES QUITS YOUTUBE - IMPAULSIVE EP. 197",2020-06-30
195,"E196 THE MOTHER OF THE PAUL BROTHERS - IMPAULSIVE EP. 196",2020-06-25
194,"E195 Logan Paul’s Message To Ninja - IMPAULSIVE EP. 195",2020-06-23
193,"E194 Ross Edgley: The Superhuman Athlete Who Swam Around Great Britain - IMPAULSIVE EP. 194",2020-06-18
192,"E193 Virtual Reality Will Ruin Your Life - IMPAULSIVE EP. 193",2020-06-16
191,"E192 North Korea Pleasure Squad Ends The World - IMPAULSIVE EP. 192",2020-06-11
190,"E191 LOGAN PAUL IS A BAD DATE - IMPAULSIVE EP. 191",2020-06-09
189,"E190 This Is America?! - IMPAULSIVE EP. 190",2020-06-04
188,"E189 America Is Racist - IMPAULSIVE EP. 189",2020-06-02
187,"E188 Impaulsive Speaks on George Floyd - IMPAULSIVE EP. 188",2020-05-28
186,"E187 MIKE’S TWIN SISTER SPEAKS OUT - IMPAULSIVE EP. 187",2020-05-26
185,"E186 IMPAULSIVE’S WORST EPISODE EVER - IMPAULSIVE EP. 186",2020-05-21
184,"E185 Ariana Grande Blocked Logan Paul & Barstool Called Their Daddy - IMPAULSIVE EP. 185",2020-05-19
183,"E184 Logan Paul VS. Dolan Dennis VS. Henry Cejudo VS. Ryan Garcia - IMPAULSIVE EP. 184",2020-05-14
182,"E183 6IX9INE IS THE NEXT ELON MUSK - IMPAULSIVE EP. 183",2020-05-12
181,"E182 Logan Paul is a Simp, The Best Way to Die, Kidnapping Monkeys - IMPAULSIVE EP. 182",2020-05-07
180,"E181 From Heroin to Hollywood: The Story of Mike Majlak - IMPAULSIVE EP. 181",2020-05-05
179,"E180 Your Daughter Does OnlyFans - IMPAULSIVE EP. 180",2020-04-30
178,"E179 LOGAN PAUL WILL BE PRESIDENT - IMPAULSIVE EP. 179",2020-04-28
177,"E178 IS LOGAN PAUL THE GREATEST YOUTUBER OF ALL TIME? - IMPAULSIVE EP. 178",2020-04-23
176,"E177 Logan Paul Documented Aliens and They Weren’t Happy About It - IMPAULSIVE EP. 177",2020-04-21
175,"E176 The Miz: Reality TV Star to WWE Champion - IMPAULSIVE EP. 176",2020-04-16
174,"E175 LOGAN PAUL AND MIKE SETTLE THE BEEF - IMPAULSIVE EP. 175",2020-04-14
173,"E174 GREG PAUL CHEATS DEATH AND EXPOSES HIS SONS - IMPAULSIVE EP. 174",2020-04-09
172,"E173 Quarantine: The Worst Time To Be Single - IMPAULSIVE EP. 173",2020-04-07
171,"E172 The Logan Paul Interview - IMPAULSIVE EP. 172",2020-04-02
170,"E171 Quarantine Sex, Hype House Drama, Drake’s Baby - IMPAULSIVE EP. 171",2020-03-31
169,"E170 JAKE PAUL IS PREPARED FOR DOOMSDAY - IMPAULSIVE EP. 170",2020-03-27
168,"E169 Logan Paul’s Addiction, Trapped with Girlfriends, Preparing for Doomsday - IMPAULSIVE EP. 169",2020-03-24
167,"E168 GOING DEEP WITH LANA RHOADES - IMPAULSIVE EP. 168",2020-03-19
166,"E167 Logan Paul on Coronavirus Fears, Self-Isolation, and Toilet Paper - IMPAULSIVE EP. 167",2020-03-17
165,"E166 What Happened to Ray William Johnson? - IMPAULSIVE EP. 166",2020-03-12
164,"E165 Logan Paul Speaks On Getting KNOCKED OUT - IMPAULSIVE EP. 165",2020-03-10
163,"E164 YouTube’s Animating Millionaire: The Odd 1s Out - IMPAULSIVE EP. 164",2020-03-05
162,"E163 WE’RE DONE WITH SEX - IMPAULSIVE EP. 163",2020-03-03
161,"E162 Logan Paul is a BAD Booty Call - IMPAULSIVE EP. 162",2020-02-27
160,"E161 Gigi Hadid and Pewdiepie Roast Jake Paul - IMPAULSIVE EP. 161",2020-02-25
159,"E160 Jake Paul Emotionally Addresses Anxiety Tweet, Lawsuits, KSI Fight - IMPAULSIVE EP. 160",2020-02-20
158,"E159 Ryan Garcia Speaks after Vicious First Round Knockout - IMPAULSIVE EP. 159",2020-02-18
157,"E158 ZACH KING REVEALS HIS SECRETS - IMPAULSIVE EP. 158",2020-02-13
156,"E157 Mike’s Cheating Scandal, Antonio Brown Diss Track, Meeting Drake - IMPAULSIVE EP. 157",2020-02-11
155,"E156 DAN PEÑA IS THE TRILLION DOLLAR MAN - IMPAULSIVE EP. 156",2020-02-04
154,"E155 BOB MENERY: FROM BROKE TO HEART BROKEN - IMPAULSIVE EP. 155",2020-01-30
153,"E154 LOGAN PAUL ADDRESSES SPITTING GIRL & MIKE LEAVES IMPAULSIVE - IMPAULSIVE EP. 154",2020-01-28
152,"E153 RUSSELL BRAND IS WOKE - IMPAULSIVE EP. 153",2020-01-23
151,"E152 MIKE AND LOGAN TALK ABOUT JOE ROGAN’S MEAT - IMPAULSIVE EP. 152",2020-01-21
150,"E151 RORY KRAMER FOUGHT JUSTIN BIEBER - IMPAULSIVE EP. 151",2020-01-16
149,"E150 THE SADDEST MOMENT IN IMPAULSIVE HISTORY - IMPAULSIVE EP. 150",2020-01-14
148,"E149 LOGAN PAUL ADDRESSES ANTONIO BROWN FIGHT & LEAKED SEX TAPE - IMPAULSIVE EP. 149",2020-01-10
147,"E148 SEX WITH EMILY - IMPAULSIVE EP. 148",2019-12-23
146,"E147 JAKE PAUL SPEAKS OUT ON FIGHTING GIB AND KSI - IMPAULSIVE EP. 147",2019-12-21
145,"E146 TREVOR WALLACE IS FUNNY - IMPAULSIVE EP. 146",2019-12-18
144,"E145 HOLLYWOOD VS. LOGAN PAUL - IMPAULSIVE EP. 145",2019-12-16
143,"E144 LOGAN PAUL’S EDITOR HAS DARK SECRETS - IMPAULSIVE EP. 144",2019-12-13
142,"E143 PETER CRONE KNOWS WHY LOGAN LOST THE FIGHT - IMPAULSIVE EP. 143",2019-12-11
141,"E142 MARIJUANA MADE HIM A MILLIONAIRE - IMPAULSIVE EP. 142",2019-12-06
140,"E141 THE 22 YEAR OLD WITH $30 MILLION IN CREDIT - IMPAULSIVE EP. 141",2019-12-04
139,"E140 SEX AND FIGHTS IN HAWAII - IMPAULSIVE EP. 140",2019-02-02
138,"E139 FROM PRISONER TO BILLIONAIRE: STEVE MADDEN - IMPAULSIVE EP. 139",2019-12-02
137,"E138 HOW WE LOST OUR VIRGINITY - IMPAULSIVE EP. 138",2019-11-29
136,"E137 HOW TO WIN A STREET FIGHT WITH CHUCK LIDDELL - IMPAULSIVE EP. 137",2019-11-27
135,"E136 SUSPENDED UFC CHAMP TJ DILLASHAW SPEAKS ON KSI VS LOGAN PAUL - IMPAULSIVE EP. 136",2019-11-25
134,"E135 WILL DAZN’S VICE PRESIDENT LET LOGAN FIGHT AGAIN? - IMPAULSIVE EP. 135",2019-11-22
133,"E134 LOGAN PAUL LET EVERYONE DOWN - IMPAULSIVE EP. 134",2019-11-20
132,"E133 COUNTDOWN TO FIGHT NIGHT WITH LOGAN PAUL - IMPAULSIVE EP. 133",2019-10-28
131,"E132 IMPAULSIVE IS CANCELED - IMPAULSIVE EP. 132",2019-10-10
130,"E131 IMPAULSIVE’S FIRST BILLIONAIRE: TILMAN FERTITTA - IMPAULSIVE EP. 131",2019-10-08
129,"E130 TIM DILLON IS FUNNY - IMPAULSIVE EP. 130",2019-10-03
128,"E129 SECRETS TO SEX, LOVE, AND RELATIONSHIPS - IMPAULSIVE EP. 129",2019-10-01
127,"E128 AARON CARTER IS BACK - IMPAULSIVE EP. 128",2019-10-01
126,"E127 GRANT CARDONE’S BILLIONAIRE ADVICE: CASH IS TRASH - IMPAULSIVE EP. 127",2019-09-25
125,"E126 LOGAN PAUL PROVES HE’S NOT A SOCIOPATH - IMPAULSIVE EP. 126",2019-09-20
124,"E125 ANNA AKANA AND LOGAN PAUL SQUASH THE BEEF - IMPAULSIVE EP. 125",2019-09-18
123,"E124 EDDIE HEARN SPEAKS OUT AFTER KSI VS LOGAN PRESS CONFERENCE - IMPAULSIVE EP. 124",2019-09-16
122,"E123 TRISHA PAYTAS VS THE VLOG SQUAD - IMPAULSIVE EP. 123",2019-09-13
121,"E122 THE MAN THAT MADE CAPTAIN AMERICA FANBOY - IMPAULSIVE EP. 122",2019-09-11
120,"E121 BEN SHAPIRO SILENCES LOGAN PAUL - IMPAULSIVE EP. 121",2019-09-11
119,"E120 IS LOGAN PAUL READY FOR HIS FIRST PROFESSIONAL FIGHT AGAINST KSI? - IMPAULSIVE EP. 120",2019-09-06
118,"E119 ANDREW SCHULZ WANTS ALL ANIMALS DEAD - IMPAULSIVE EP. 119",2019-09-04
117,"E118 DO YOU BELIEVE IN TOXIC MASCULINITY? - IMPAULSIVE EP. 118",2019-09-02
116,"E117 NIPSEY HUSSLE CONVINCED GASHI TO DROP OUT OF SCHOOL - IMPAULSIVE EP. 117",2019-08-30
115,"E116 MEET THE 21 YEAR OLD YOUTUBER WHO LIVES OUT OF HER VAN - IMPAULSIVE EP. 116",2019-08-28
114,"E115 DID KYLE MASSEY LIVE IN THE WHITE HOUSE? - IMPAULSIVE EP. 115",2019-08-26
113,"E114 IS DRAKE BETTER THAN THE BEATLES? - IMPAULSIVE EP. 114",2019-08-23
112,"E113 ERIK GRIFFIN THE COMEDIAN - IMPAULSIVE EP. 113",2019-08-21
111,"E112 MEET THE VOICE OF YOUR FAVORITE CHILDHOOD CARTOONS - IMPAULSIVE EP. 112",2019-08-19
110,"E111 CHANEL WEST COAST MEETS HER NUMBER NEIGHBOR ON IMPAULSIVE - IMPAULSIVE EP. 111",2019-08-16
109,"E110 MASTER IMPRESSIONIST VINCENT MARCUS CAN BECOME JAMES CHARLES - IMPAULSIVE EP. 110",2019-08-14
108,"E109 LOGAN PAUL GETS EXPOSED IN IBIZA - IMPAULSIVE EP. 109",2019-08-14
107,"E108 FAZE CENSOR HAS A MESSAGE FOR FAZE CLAN - IMPAULSIVE EP. 108",2019-08-05
106,"E107 UFO EXPERT DR. GREER REVEALS FIRST EVER PHOTO OF AN ALIEN - IMPAULSIVE EP. 107",2019-08-02
105,"E106 PIQUES USED TO BE CRISTIANO RONALDO’S ROOMMATE - IMPAULSIVE EP. 106",2019-07-31
104,"LIVE FROM JAKE PAUL AND TANA MONGEAU’S WEDDING - IMPAULSIVE EP. 105",2019-07-29
103,"THE FOOD GOD’S $1,000,000 DIET - IMPAULSIVE EP. 104",2019-07-26
102,"LOGAN PAUL SPEAKS ON GOING BROKE AND THE DEATH OF MAVERICK - IMPAULSIVE EP. 103",2019-07-24
101,"DREAM EXPERT REVEALS THE MEANING OF YOUR DREAMS - IMPAULSIVE EP. 102",2019-07-22
100,"LOGAN PAUL IS A LIAR - IMPAULSIVE EP. 101",2019-07-19
99,"100 LIVE! THE 100TH EPISODE OF IMPAULSIVE",2019-07-18
98,"THE BEST MOMENTS FROM 99 EPISODES OF IMPAULSIVE - BONUS EPISODE",2019-07-12
97,"BELLA THORNE’S TRAUMATIC PAST - IMPAULSIVE EP. 99",2019-07-10
96,"WHAT HAPPENED TO DEVON WERKHEISER FROM NED’S DECLASSIFIED? - IMPAULSIVE - EP. 98",2019-07-08
95,"CESAR MILLAN, THE DOG WHISPERER - IMPAULSIVE EP. 97",2019-07-05
94,"ERIC WEINSTEIN IS THE SMARTEST MAN IN THE WORLD - IMPAULSIVE EP. 96",2019-07-03
93,"THIS GUY WILL MAKE YOU RICH - IMPAULSIVE EP. 95",2019-07-01
92,"THE STORY OF US - IMPAULSIVE EP. 94",2019-06-28
91,"A MESSAGE TO JAKE AND TANA - IMPAULSIVE EP. 93",2019-06-26
