"episode_number","title","date"
90,"MICHAEL JAI WHITE GOT SHOT AND BECAME A BADASS - IMPAULSIVE EP. 92",2019-06-24
89,"THE GABBIE SHOW IS DEAD - IMPAULSIVE EP. 91",2019-06-21
88,"PAGE KENNEDY CALLS OUT 50 CENT - IMPAULSIVE EP. 90",2019-06-19
87,"Superfood HUNTER Darin Olien lost everything in the Malibu WILDFIRES - IMPAULSIVE EP. 89",2019-06-17
86,"LOSING OUR FRIEND DWARF MAMBA - IMPAULSIVE EP. 88",2019-06-14
85,"HOPSIN FREESTYLES WITH IMPAULSIVE - IMPAULSIVE EP. 87",2019-06-12
84,"A MESSAGE TO JUSTIN BIEBER - IMPAULSIVE EP. 86",2019-06-11
83,"UFC FIGHTER PAIGE VANZANT GOT KNOCKED OUT BY HER HUSBAND - IMPAULSIVE EP. 85",2019-06-07
82,"NOOR STARS WENT FROM REFUGEE TO THE MIDDLE EAST’S MOST POPULAR STAR - IMPAULSIVE EP. 84",2019-06-05
81,"THIS GIRL HAS DADDY ISSUES - IMPAULSIVE EP. 83",2019-06-03
80,"Superhuman Psychic Vincent Genna KNOWS Why Logan Paul went to Japan - IMPAULSIVE EP. 82",2019-05-31
79,"The Untold Stories of The WOLF OF WALL STREET, Jordan Belfort - IMPAULSIVE EP. 81",2019-05-29
78,"How Brittany Furlan escaped depression & Married a Rockstar - IMPAULSIVE EP. 80",2019-05-27
77,"MR. CHECKPOINT’S POLICE PROBLEM - IMPAULSIVE EP. 79",2019-05-24
76,"NICK BATEMAN POOPS HIS PANTS - IMPAULSIVE EP. 78",2019-05-22
75,"Ryan Serhant, the Reality Star and Real Estate BILLIONAIRE - IMPAULSIVE EP. 77",2019-05-20
74,"Steve Weatherford: NFL Superbowl Champion turned Fitness God - IMPAULSIVE EP. 76",2019-05-17
73,"DEAR JAMES CHARLES - IMPAULSIVE EP. 75",2019-05-15
72,"Beautiful, bad, and bold: Himynamesteee - IMPAULSIVE EP. 74",2019-05-13
71,"Timothy DeLaGhetto speaks w/ Logan Paul about his Japan Scandal & Asian Culture - IMPAULSIVE EP. 73",2019-05-10
70,"Lamar Odom speaks on sobriety, the Kardashians, and Riley Reid - IMPAULSIVE EP. 72",2019-05-08
69,"THE 19 YEAR OLD CELEBRITY PHOTOGRAPHER FOR MILEY CYRUS, HALSEY, AND SHAWN MENDES - IMPAULSIVE EP. 71",2019-05-06
68,"WHAT HAPPENED TO JERRY PURPDRANK? - IMPAULSIVE EP. 70",2019-05-04
67,"COLIN O’BRADY IS THE FIRST MAN TO WALK ACROSS ANTARCTICA BY HIMSELF - IMPAULSIVE EP. 69",2019-05-01
66,"Charlie Rocket: 300 lb MUSIC MILLIONAIRE to Ironman ATHLETE - IMPAULSIVE EP. 68",2019-04-29
65,"AMANDA CERNY FINDS THE G SPOT - IMPAULSIVE EP. 67",2019-04-26
64,"Ray J: From Kim K to Tech Business Mogul - IMPAULSIVE EP. 66",2019-04-24
63,"Nimai Delgado: The Bodybuilder Who’s NEVER Eaten Meat - IMPAULSIVE EP. 65",2019-04-22
62,"JENA FRUMES IS A BEAUTIFUL BADASS - IMPAULSIVE EP. 63",2019-04-17
61,"CALL HER DADDY SHOWS US HOW TO GET LAID (PART 2) - IMPAULSIVE EP. 62",2019-04-15
60,"THE CALL HER DADDY GIRLS GET SLOPPY (PART 1) - IMPAULSIVE EP. 61",2019-04-12
59,"ALEX JONES IS... ALEX JONES - IMPAULSIVE EP. 60",2019-04-10
58,"Hollywood Life SLAMS JAKE PAUL, Cancel Culture & Modern Day Parenting - IMPAULSIVE EP. 59",2019-04-09
57,"The Reality of Mixed Martial Arts with UFC CHAMP Urijah Faber - IMPAULSIVE EP. 58",2019-04-05
56,"MODERN DAY TARZAN IS THE NEXT STEVE IRWIN - IMPAULSIVE EP. 57",2019-04-03
55,"ALEX WASSABI SPEAKS OUT ON EX-GIRLFRIEND, EX-PARTNER, AND EXERCISE - IMPAULSIVE EP. 56",2019-04-01
54,"JAKE PAUL IS MAKING A BIG COMEBACK - IMPAULSIVE EP. 55",2019-03-29
53,"TRAVIS MILLS KNOWS WHY DAVID DOBRIK DIDN’T DO IMPAULSIVE - IMPAULSIVE EP. 54",2019-03-27
52,"THE BOYS TALK SH*T: EX-GIRLFRIENDS, FIST FIGHTS, AND COLLEGE - IMPAULSIVE EP. 53",2019-03-25
51,"BOW HUNTER CAMERON HANES SHOOTS TO KILL - IMPAULSIVE EP. 52",2019-03-22
50,"CHANTEL JEFFRIES BELIEVES WE’RE LIVING IN A SIMULATION - IMPAULSIVE EP. 51",2019-03-20
49,"ADAM 22 GOT ROBBED AT GUNPOINT WITH LENA THE PLUG - IMPAULSIVE EP. 50",2019-03-19
48,"HOW KING BACH AVOIDED HERPES, R KELLY, AND CONTROVERSY - IMPAULSIVE EP. 49",2019-03-15
47,"MOTHER YOUTUBE HATES THE RACKA RACKA TWINS - IMPAULSIVE EP. 48",2019-03-13
46,"WARNING: JAMES ASPEY WILL MAKE YOU GO VEGAN - IMPAULSIVE EP. 47",2019-03-11
45,"IS TAI LOPEZ A MILLION DOLLAR SCAM ARTIST? - IMPAULSIVE EP. 46",2019-03-08
44,"MR. BEAST HATES YOUTUBE - IMPAULSIVE EP. 45",2019-03-06
43,"JAKE PAUL BREAKS THE INTERNET - IMPAULSIVE EP. 44",2019-03-04
42,"BRADLEY MARTYN IS THE WORLDfS STRONGEST MAN - IMPAULSIVE EP. 43",2019-03-01
41,"UFC CHAMPION TYRON WOODLEY WILL BEAT YOUR ASS - IMPAULSIVE EP. 42",2019-02-27
40,"THE KENT STATE GUN GIRL WITHOUT HER GUNS - IMPAULSIVE EP. 41",2019-02-25
39,"TANA MONGEAU TALKS ABOUT HER SEXUALITY, THREESOMES, AND KYLIE JENNER - IMPAULSIVE EP. 40",2019-02-22
38,"JAY SHETTY WENT FROM MONK TO MILLIONAIRE - IMPAULSIVE EP. 39",2019-02-20
37,"DRAMA: FROM ROB & BIG TO YOUNG & RECKLESS - IMPAULSIVE EP. 38",2019-02-18
36,"FOUSEY’S FIRST ON CAMERA APPEARANCE IN SIX MONTHS - IMPAULSIVE EP. 37",2019-02-16
35,"DAX BELIEVES HE IS ONE OF THE BEST RAPPERS ALIVE - IMPAULSIVE EP. 36",2019-02-13
34,"FROM EATING ROADKILL TO CRAVING ADVENTURE: FUN FOR LOUIS - IMPAULSIVE EP. 35",2019-02-11
33,"THE GUYS WHO SAY “YES” TO EVERYTHING - IMPAULSIVE EP. 34",2019-02-08
32,"MEET HOLLYWOOD’S SECRET CELEBRITY BOXING COACH - IMPAULSIVE EP. 33",2019-02-06
31,"HOW THE INTERNET DESTROYED ELLE MILLS - IMPAULSIVE EP. 32",2019-02-04
30,"VITALY IS YOUTUBE’S MOST NOTORIOUS VILLAIN - IMPAULSIVE EP. 31",2019-02-01
29,"IS THE SLUT WHISPERER A GENIUS OR A SCUMBAG? - IMPAULSIVE EP. 30",2019-01-30
28,"FAZE RUG TALKS COCAINE, TFUE, AND FIGHTING A YOUTUBER - IMPAULSIVE EP. 29",2019-01-28
27,"MAGIC TRICKS MADE JULIUS DEIN A MULTI-MILLIONAIRE - IMPAULSIVE EP. 28",2019-01-25
26,"THE NELK BOYS TALK PRISON, PRANKS, AND PARTIES - IMPAULSIVE EP. 27",2019-01-23
25,"LOGAN PAUL ADDRESSES ’GOING GAY’ CONTROVERSY WITH JOSH SEEFRIED - IMPAULSIVE EP. 26",2019-01-21
24,"THE INSANE LIFE OF THE PAPARAZZI - IMPAULSIVE EP. 25",2019-01-11
23,"BROTHER NATURE REVEALS HOW HE SPEAKS TO ANIMALS - IMPAULSIVE EP. 24",2019-01-09
22,"RYAN GARCIA THINKS THE EARTH IS FLAT - IMPAULSIVE EP. 23",2019-01-07
21,"RICEGUM SPEAKS ON GAMBLING, BEEF, AND CHINA CONTROVERSY - IMPAULSIVE EP. 22",2019-01-04
20,"KRISTEN HANCHER SAYS EX BOYFRIEND STOLE HER MONEY - IMPAULSIVE EP. 21",2018-12-31
19,"TANNER FOX LOOKED DEATH IN THE FACE - IMPAULSIVE EP. 20",2018-12-28
18,"HUSBAND AND WIFE ADULT FILM STARS JOHNNY & KISSA SINS - IMPAULSIVE EP. 19",2018-12-26
17,"HOW DEADPOOL & DWAYNE JOHNSON SAVED KEVIN HINES LIFE - IMPAULSIVE EP. 18",2018-12-24
16,"FARRAH ABRAHAM ON SEX TAPE, TEEN MOM & JAIL - IMPAULSIVE EP. 17",2018-12-21
15,"ACHIEVING CONFIDENCE, GOALS & SUCCESS WITH LEWIS HOWES - IMPAULSIVE EP. 16",2018-12-19
14,"LOGAN PAUL TALKS 2018 LIFE LESSONS WITH ACCESS HOLLYWOOD - IMPAULSIVE EP. 15",2018-12-18
13,"**ASMR** 13 YEAR OLD WHISPERING MILLIONAIRE - IMPAULSIVE EP. 14",2018-12-17
12,"BRENDAN SCHAUB AND LOGAN PAUL ARE ESKIMO BROTHERS - IMPAULSIVE EP. 13",2018-12-14
11,"MEET JACOB SARTORIUS, THE MOST POPULAR KID ON THE INTERNET - IMPAULSIVE EP. 12",2018-12-12
10,"JOSH PECK REVEALS WHY DAVID DOBRIK HATES LOGAN PAUL - IMPAULSIVE EP. 11",2018-12-10
9,"HOW STEVE-O LOST HIS PENIS - IMPAULSIVE EP. 10",2018-12-08
8,"WHY DEJI HATES HIS BROTHER KSI - IMPAULSIVE EP. 9",2018-12-07
7,"GOING DEEP WITH RILEY REID - IMPAULSIVE EP. 8",2018-12-06
6,"SEX, ROBBERY & CARS WITH AUSTIN MCBROOM - IMPAULSIVE EP. 7",2018-12-03
5,"JUANPA ZURITA KISSED ME - IMPAULSIVE EP. 6",2018-12-01
4,"MIKE STRANGLED HALSEY - IMPAULSIVE EP. 4",2018-11-26
3,"I GAVE SOMMER RAY THE D - IMPAULSIVE EP. 3",2018-11-23
2,"JOJO SIWA IS BETTER THAN YOU - IMPAULSIVE EP. 2",2018-11-21
1,"ADVICE FROM A SEXPERT - IMPAULSIVE EP. 1",2018-11-19